{
  "$schema": "https://synchro.dev/conformance/schemas/fault-catalog-v1.schema.json",
  "schema_version": 1,
  "release": "0.4.0-rc.3",
  "faults": [
    { "id": "FAULT-TIME-001", "description": "Emit a non-UTC, noncanonical wire timestamp instead of the field's required RFC 3339 representation." },
    { "id": "FAULT-CURSOR-001", "description": "Parse and rewrite an opaque scope cursor before presenting it to the server." },
    { "id": "FAULT-VERSION-001", "description": "Sort or synthesize an opaque server version from client-visible data." },
    { "id": "FAULT-SCOPE-001", "description": "Accept a client-authored scope instance as authoritative assignment." },
    { "id": "FAULT-SCOPE-002", "description": "Advance or reuse scope_set_version independently of an assigned scope-set change." },
    { "id": "FAULT-SCHEMA-001", "description": "Let the client choose schema action or accept the fresh sentinel for a continuing identity." },
    { "id": "FAULT-LOCALSQL-001", "description": "Require an application upload API instead of allowing local SQLite CRUD." },
    { "id": "FAULT-CRUD-001", "description": "Route a registered table's CRUD synchronization through an application-specific transport." },
    { "id": "FAULT-MUTATION-001", "description": "Remove a captured local mutation without a durable terminal outcome or explicit policy." },
    { "id": "FAULT-MUTATION-002", "description": "Mark an outcome terminal while retaining a stale canonical row or server version." },
    { "id": "FAULT-MUTATION-003", "description": "Create a second queue entry for one logical action during replay or authoritative echo." },
    { "id": "FAULT-APPLY-001", "description": "Run server-originated row application with local change capture enabled." },
    { "id": "FAULT-VERSION-002", "description": "Reuse the old row version or derive the accepted version from client_version or updated_at." },
    { "id": "FAULT-CLEANUP-001", "description": "Turn scope cleanup into a client delete mutation without an authoritative tombstone." },
    { "id": "FAULT-WAL-001", "description": "Drop an unmaterializable committed change and continue later WAL processing." },
    { "id": "FAULT-SCOPE-003", "description": "Treat scope evaluation failure as empty membership or return nondeterministic membership." },
    { "id": "FAULT-REBUILD-001", "description": "Wipe unrelated scope rows or local-only rows during a single-scope rebuild." },
    { "id": "FAULT-CURSOR-002", "description": "Install a scope cursor before every incremental outcome for that scope is validated and durable." },
    { "id": "FAULT-INTEGRITY-001", "description": "Mark a scope healthy from a valid cursor without independently matching its authoritative digest." },
    { "id": "FAULT-INTEGRITY-002", "description": "Accept terminal pull progress without verifying the authoritative final checksums." },
    { "id": "FAULT-REBUILD-002", "description": "Declare rebuild complete before stale provenance pruning, zero-provenance removal, digest match, or final cursor install." },
    { "id": "FAULT-PROVENANCE-001", "description": "Delete a local row during one scope rebuild while another valid scope still justifies it." },
    { "id": "FAULT-REBUILD-003", "description": "Use incremental first-sync behavior for a scope with no usable cursor." },
    { "id": "FAULT-QUEUE-001", "description": "Regenerate or lose queued mutation identity and authored ordering across process restart." },
    { "id": "FAULT-REBUILD-004", "description": "Install a final rebuild cursor or checksum after restart from an unverifiable partial state." },
    { "id": "FAULT-CURSOR-003", "description": "Commit a scope cursor separately from the local apply transaction." },
    { "id": "FAULT-MUTATION-004", "description": "Delete rejected mutation reasons during restart or schema reconciliation without client policy." },
    { "id": "FAULT-PROVENANCE-002", "description": "Leave stale, missing, or cross-row scope provenance after materialization changes." },
    { "id": "FAULT-SEED-001", "description": "Treat seeded contents or metadata as an authority outside normal authenticated sync." },
    { "id": "FAULT-SEED-002", "description": "Export an undeclared or auth-scoped row because it happens to be present." },
    { "id": "FAULT-SEED-003", "description": "Install seeded rows as incrementally resumable without verified continuation receipt metadata." },
    { "id": "FAULT-QUEUE-002", "description": "Reject eligible pre-connect local writes, fabricate a seed base version, or store intent outside the durable queue." },
    { "id": "FAULT-FAILURE-001", "description": "Advance queue, cursor, schema, rebuild, or apply state after a retryable transport failure." },
    { "id": "FAULT-FAILURE-002", "description": "Continue synchronization silently after a non-retryable protocol or local contract error." },
    { "id": "FAULT-REBUILD-005", "description": "Wait for application approval instead of automatically executing a server-required rebuild." },
    { "id": "FAULT-BOUNDARY-001", "description": "Implement scope, conflict, rebuild, or synced-write semantics in the Go adapter." },
    { "id": "FAULT-BOUNDARY-002", "description": "Implement queue, cursor, conflict, or rebuild semantics independently in React Native JavaScript." },
    { "id": "FAULT-BOUNDARY-003", "description": "Override server assignment or conflict decisions in a native client or delegate durable state to JavaScript." },
    { "id": "FAULT-CRUD-002", "description": "Require a custom application upload endpoint to complete a local SQL CRUD sync." },
    { "id": "FAULT-SCOPE-005", "description": "Execute a client-authored replication predicate or arbitrary scope SQL." },
    { "id": "FAULT-PERFORMANCE-001", "description": "Add an outbound sync-service RPC to the production PostgreSQL extension request path." },
    { "id": "FAULT-VOCAB-001", "description": "Accept push create, push upsert, implicit insert, or implicit resurrection." },
    { "id": "FAULT-WAL-002", "description": "Publish pull-visible effects synchronously beside push or without a WAL replay identity." },
    { "id": "FAULT-WAL-003", "description": "Order WAL transactions by timestamp, notification, table, or poll order instead of commit LSN and source ordinal." },
    { "id": "FAULT-WAL-004", "description": "Replay one source transaction as independently durable units or duplicate its materialized effects on retry." },
    { "id": "FAULT-WAL-005", "description": "Acknowledge an incomplete or noncontiguous transaction beyond the largest durable contiguous prefix." },
    { "id": "FAULT-WAL-006", "description": "Log and skip a poison transaction or acknowledge later transactions before quarantine recovery." },
    { "id": "FAULT-WAL-007", "description": "Select a registry generation by notification or switch generations within one source transaction." },
    { "id": "FAULT-REGISTRY-001", "description": "Resolve a registered relation by bare name or search_path and silently rebind after OID drift." },
    { "id": "FAULT-REGISTRY-002", "description": "Keep a relation active with a nonportable key, wrong replica identity, or key-changing update." },
    { "id": "FAULT-WAL-008", "description": "Report capture ready when a worker, trigger, slot, poison, registry, or contiguous-progress check is unhealthy." },
    { "id": "FAULT-IDEMPOTENCY-001", "description": "Re-execute completed batch work or return a changed response for equal identity and fingerprint." },
    { "id": "FAULT-IDEMPOTENCY-002", "description": "Re-execute an equal mutation in a new batch or accept a different fingerprint instead of failing the request." },
    { "id": "FAULT-IDEMPOTENCY-003", "description": "Expire or compact an idempotency ledger entry without irreversible client retirement." },
    { "id": "FAULT-ATOMICITY-001", "description": "Commit a subset of first-push response, outcomes, source writes, versions, or fences after an operational failure." },
    { "id": "FAULT-OUTCOME-001", "description": "Omit, duplicate, cross-list, reorder, or retry-classify a requested mutation in an HTTP 200 outcome." },
    { "id": "FAULT-CONFLICT-001", "description": "Check base_version without row locking or write source and version fence in separate transactions." },
    { "id": "FAULT-CONFLICT-002", "description": "Allow concurrent update and delete attempts from one base version to both succeed or lose the winner." },
    { "id": "FAULT-TIME-002", "description": "Use equal, past, or future client_version to select a conflict winner, row version, updated_at, or write order." },
    { "id": "FAULT-SCHEMA-002", "description": "Drop, rewrite, auto-retry, or stop retaining the complete authored payload of schema-incompatible intent." },
    { "id": "FAULT-FAILURE-003", "description": "Change batch identity, order, or canonical content after response loss or HTTP 429/503 retry." },
    { "id": "FAULT-QUEUE-003", "description": "Fold changed intent into the original mutation identity or delete unchanged authored content." },
    { "id": "FAULT-PULL-001", "description": "Apply the global page limit before resolving each valid scope's complete eligible candidate stream." },
    { "id": "FAULT-PULL-002", "description": "Merge scope streams with lexical or unstable ordering or compute has_more from only the selected stream." },
    { "id": "FAULT-PULL-003", "description": "Silently omit a selected candidate, hydrate it from a live row, or commit a partial page." },
    { "id": "FAULT-PULL-004", "description": "Deduplicate by text record identity alone and collapse equal typed identities across logical tables." },
    { "id": "FAULT-CURSOR-004", "description": "Advance a durable scope checkpoint during selection, response construction, token issuance, rebuild paging, or with an old cursor." },